DB00489;Sotalol;arrhythmias cardiac;0;1;0,833333;153;154;3757; ; ; ; ; ; ; ; ; ; ; ; ; ; ; ; ; ; ; ; ; ; ;"""Sotalol hydrochloride tablets, USP are indicated for the treatment of documented ventricular arrhythmias, such as sustained ventricular tachycardia, that in the judgment of the physician are life-threatening. Because of the proarrhythmic effects of sotalol hydrochloride tablets, USP (see WARNINGS), including a 1.5 to 2% rate of Torsade de Pointes or new VT/VF in patients with either NSVT or supraventricular arrhythmias, its use in patients with less severe arrhythmias, even if the patients are symptomatic, is generally not recommended. Treatment of patients with asymptomatic ventricular premature contractions should be avoided. Initiation of sotalol hydrochloride treatment or increasing doses, as with other antiarrhythmic agents used to treat life-threatening arrhythmias, should be carried out in the hospital. The response to treatment should then be evaluated by a suitable method (e.g., PES or Holter monitoring) prior to continuing the patient on chronic therapy. Various approaches have been used to determine the response to antiarrhythmic therapy, including sotalol hydrochloride tablets, USP. In the ESVEM Trial, response by Holter monitoring was tentatively defined as 100% suppression of ventricular tachycardia, 90% suppression of non-sustained VT, 80% suppression of paired VPCs, and 75% suppression of total VPCs in patients who had at least 10 VPCs/hour at baseline"DB00491;Miglitol;diabetes mellitus;0;1;0,978261;2595;8972;2548;23193; ; ; ; ; ; ; ; ; ; ; ; ; ; ; ; ; ; ; ; ; ;GLYSET is indicated as an adjunct to diet and exercise to improve glycemic control in adults with type 2 diabetes mellitus.DB00494;Entacapone;parkinson disease;0;1;0,454545;1312; ; ; ; ; ; ; ; ; ; ; ; ; ; ; ; ; ; ; ; ; ; ; ; ;Entacapone Tablets are indicated as an adjunct to levodopa and carbidopa to treat patients with idiopathic Parkinsons Disease who experience the signs and symptoms of end-of-dose wearing-off (see CLINICAL PHARMACOLOGY, Clinical Studies). Entacapone Tablets effectiveness has not been systematically evaluated in patients with idiopathic Parkinsons Disease who do not experience end-of-dose wearing-off.DB00499;Flutamide;prostatic neoplasms;0;1;0,979592;367;196; ; ; ; ; ; ; ; ; ; ; ; ; ; ; ; ; ; ; ; ; ; ; ;Flutamide Capsules are indicated for use in combination with LHRH-agonists for the management of locally confined Stage B2-C and Stage D2 metastatic carcinoma of the prostate. Stage B2-C Prostatic Carcinoma Treatment with Flutamide Capsules and the goserelin acetate implant should start 8 weeks prior to initiating radiation therapy and continue during radiation therapy. Stage D2 Metastatic Carcinoma To achieve benefit from treatment, Flutamide Capsules should be initiated with the LHRH- agonist and continued until progression.DB00522;Bentiromide;pancreatic diseases;0;0;NA;3249; ; ; ; ; ; ; ; ; ; ; ; ; ; ; ; ; ; ; ; ; ; ; ; ; DB00523;Alitretinoin;skin diseases;0;1;NA;6258;5915;5914;5916;6257;6256; ; ; ; ; ; ; ; ; ; ; ; ; ; ; ; ; ; ; ;Panretin gel is indicated for topical treatment of cutaneous lesions in patients with AIDS-related Kaposi's sarcoma. Panretin gel is not indicated when systemic anti-KS therapy is required (e.g., more than 10 new KS lesions in the prior month, symptomatic lymphedema, symptomatic pulmonary KS, or symptomatic visceral involvement). There is no experience to date using Panretin gel with systemic anti-KS treatment.DB00530;Erlotinib;adenocarcinoma;0;1;0,867925;1956;8856; ; ; ; ; ; ; ; ; ; ; ; ; ; ; ; ; ; ; ; ; ; ; ;TARCEVA is a kinase inhibitor indicated for: First-line treatment of patients with metastatic non-small cell lung cancer (NSCLC) whose tumors have epidermal growth factor receptor (EGFR) exon 19 deletions or exon 21 (L858R) substitution mutations as detected by an FDA-approved test. ( 1.1) Maintenance treatment of patients with locally advanced or metastatic NSCLC whose disease has not progressed after four cycles of platinum-based first-line chemotherapy. ( 1.1) Treatment of locally advanced or metastatic NSCLC after failure of at least one prior chemotherapy regimen. ( 1.1) First-line treatment of patients with locally advanced, unresectable or metastatic pancreatic cancer, in combination with gemcitabine. ( 1.2) Limitations of Use: TARCEVA is not recommended for use in combination with platinum-based chemotherapy. Safety and efficacy of TARCEVA have not been evaluated as first-line treatment in patients with metastatic NSCLC whose tumors have EGFR mutations other than exon 19 deletions or exon 21 (L858R) substitution.DB00537;Ciprofloxacin;joint diseases;0;1;NA;7153; ; ; ; ; ; ; ; ; ; ; ; ; ; ; ; ; ; ; ; ; ; ; ; ;"""Ciprofloxacin tablets are indicated for the treatment of infections caused by susceptible isolates of the designated microorganisms in the conditions and patient populations listed below. Please see DOSAGE AND ADMINISTRATION for specific recommendations. Urinary Tract Infections caused by Escherichia coli, Klebsiella pneumoniae, Enterobacter cloacae, Serratia marcescens, Proteus mirabilis, Providencia rettgeri, Morganella morganii, Citrobacter koseri (diversus), Citrobacter freundii, Pseudomonas aeruginosa, methicillin-susceptible Staphylococcus epidermidis, Staphylococcus saprophyticus, or vancomycin-susceptible Enterococcus faecalis. Acute Uncomplicated Cystitis in Females caused by Escherichia coli or Staphylococcus saprophyticus. Chronic Bacterial Prostatitis caused by Escherichia coli or Proteus mirabilis. Lower Respiratory Tract Infections caused by Escherichia coli, Klebsiella pneumoniae, Enterobacter cloacae, Proteus mirabilis, Pseudomonas aeruginosa, Haemophilus influenzae, Haemophilus parainfluenzae, or penicillin-susceptible Streptococcus pneumoniae. * Also, Moraxella catarrhalis for the treatment of acute exacerbations of chronic bronchitis. *Ciprofloxacin is not a drug of first choice in the treatment of presumed or confirmed pneumonia secondary to Streptococcus pneumoniae. Acute Sinusitis caused by Haemophilus influenzae, penicillin-susceptible Streptococcus pneumoniae, or Moraxella catarrhalis. Skin and Skin Structure Infections caused by Escherichia coli, Klebsiella pneumoniae, Enterobacter cloacae, Proteus mirabilis, Proteus vulgaris, Providencia stuartii, Morganella morganii, Citrobacter freundii, Pseudomonas aeruginosa, methicillin-susceptible, Staphylococcus aureus, methicillin-susceptible Staphylococcus epidermidis, or Streptococcus pyogenes. Bone and Joint Infections caused by Enterobacter cloacae, Serratia marcescens, or Pseudomonas aeruginosa. Complicated Intra-Abdominal Infections (used in combination with metronidazole) caused by Escherichia coli, Pseudomonas aeruginosa, Proteus mirabilis, Klebsiella pneumoniae, or Bacteroides fragilis. Infectious Diarrhea caused by Escherichia coli (enterotoxigenic isolates), Campylobacter jejuni, Shigella boydii *, Shigella dysenteriae, Shigella flexneri or Shigella sonnei* when antibacterial therapy is indicated. * Although treatment of infections due to this organism in this organ system demonstrated a clinically significant outcome, efficacy was studied in fewer than 10 patients. Typhoid Fever (Enteric Fever) caused by Salmonella typhi. NOTE: The efficacy of ciprofloxacin in the eradication of the chronic typhoid carrier state has not been demonstrated. Uncomplicated Cervical and Urethral Gonorrhea due to Neisseria gonorrhoeae. Complicated Urinary Tract Infections and Pyelonephritis due to Escherichia coli. NOTE: Although effective in clinical trials, ciprofloxacin is not a drug of first choice in the pediatric population due to an increased incidence of adverse events compared to controls, including events related to joints and/or surrounding tissues. (SeeWARNINGS, PRECAUTIONS, Pediatric Use, ADVERSE REACTIONS and CLINICAL STUDIES.) Ciprofloxacin, like other fluoroquinolones, is associated with arthropathy and histopathological changes in weight-bearing joints of juvenile animals. (SeeANIMAL PHARMACOLOGY.) Inhalational Anthrax (post-exposure): To reduce the incidence or progression of disease following exposure to aerosolized Bacillus anthracis. Ciprofloxacin serum concentrations achieved in humans served as"DB00541;Vincristine;leukemia;0;1;NA;203068;7277; ; ; ; ; ; ; ; ; ; ; ; ; ; ; ; ; ; ; ; ; ; ; ;Vincristine sulfate injection is indicated in acute leukemia. Vincristine sulfate injection has also been shown to be useful in combination with other oncolytic agents in Hodgkins disease, nonHodgkins malignant lymphomas, rhabdomyosarcoma, neuroblastoma, and Wilms tumor.DB00549;Zafirlukast;asthma;0;1;0,263158;10800; ; ; ; ; ; ; ; ; ; ; ; ; ; ; ; ; ; ; ; ; ; ; ; ;Zafirlukast tablets are indicated for the prophylaxis and chronic treatment of asthma in adults and children 5 years of age and older.DB00555;Lamotrigine;epilepsy;0;1;0,679549;6326; ; ; ; ; ; ; ; ; ; ; ; ; ; ; ; ; ; ; ; ; ; ; ; ;Lamotrigine tablets USP are indicated for: Epilepsy adjunctive therapy in patients aged 2 years and older: Partial-onset seizures. primary generalized tonic-clonic seizures. generalized seizures of Lennox-Gastaut syndrome. ( 1.1) Epilepsymonotherapy in patients aged 16 years and older: Conversion to monotherapy in patients with partial-onset seizures who are receiving treatment with carbamazepine, phenytoin, phenobarbital, primidone, or valproate as the single AED. (1.1) Bipolar disorder in patients aged 18 years and older: Maintenance treatment of bipolar I disorder to delay the time to occurrence of mood episodes in patients treated for acute mood episodes with standard therapy. (1.2)DB00563;Methotrexate;arthritis rheumatoid;0;1;0,479912;1719; ; ; ; ; ; ; ; ; ; ; ; ; ; ; ; ; ; ; ; ; ; ; ; ;Neoplastic Diseases Methotrexate is indicated in the treatment of gestational choriocarcinoma, chorio-adenoma destruens and hydatidiform mole. Methotrexate is used in maintenance therapy in combination with other chemotherapeutic agents. Methotrexate is used alone or in combination with other anticancer agents in the treatment of breast cancer, epidermoid cancers of the head and neck, advanced mycosis fungoides (cutaneous T cell lymphoma), and lung cancer, particularly squamous cell and small cell types. Methotrexate is also used in combination with other chemotherapeutic agents in the treatment of advanced stage non-Hodgkins lymphomas. Psoriasis Methotrexate is indicated in the symptomatic control of severe, recalcitrant, disabling psoriasis that is not adequately responsive to other forms of therapy, but only when the diagnosis has been established, as by biopsy and/or after dermatologic consultation. It is important to ensure that a psoriasis flare is not due to an undiagnosed concomitant disease affecting immune responses. Rheumatoid Arthritis including Polyarticular-Course Juvenile Rheumatoid Arthritis Methotrexate is indicated in the management of selected adults with severe, active, rheumatoid arthritis (ACR criteria), or children with active polyarticular-course juvenile rheumatoid arthritis, who have had an insufficient therapeutic response to, or are intolerant of, an adequate trial of first-line therapy including full dose non-steroidal anti-inflammatory agents (NSAIDs). Aspirin, NSAIDs, and/or low dose steroids may be continued, although the possibility of increased toxicity with concomitant use of NSAIDs including salicylates has not been fully explored. (See PRECAUTIONS, Drug Interactions.) Steroids may be reduced gradually in patients who respond to methotrexate. Combined use of methotrexate with gold, penicillamine, hydroxychloroquine, sulfasalazine, or cytotoxic agents, has not been studied and may increase the incidence of adverse effects. Rest and physiotherapy as indicated should be continued.DB00564;Carbamazepine;epilepsy;0;1;0,773585;6331; ; ; ; ; ; ; ; ; ; ; ; ; ; ; ; ; ; ; ; ; ; ; ; ;Carbamazepine Tablets USP and Carbamazepine Tablets USP (chewable) are indicated for use as an anticonvulsant drug. Evidence supporting efficacy of Carbamazepine Tablets USP and Carbamazepine Tablets USP (chewable) as an anticonvulsant was derived from active drug-controlled studies that enrolled patients with the following seizure types: 1. Partial seizures with complex symptomatology (psychomotor, temporal lobe). Patients with these seizures appear to show greater improvement than those with other types. 2. Generalized tonic-clonic seizures (grand mal). 3. Mixed seizure patterns which include the above, or other partial or generalized seizures. Absence seizures (petit mal) do not appear to be controlled by Carbamazepine Tablets USP and Carbamazepine Tablets USP (chewable) (see PRECAUTIONS, General). Carbamazepine Tablets USP and Carbamazepine Tablets USP (chewable) are indicated in the treatment of the pain associated with true trigeminal neuralgia. Beneficial results have also been reported in glossopharyngeal neuralgia. This drug is not a simple analgesic and should not be used for the relief of trivial aches or pains.DB00570;Vinblastine;breast neoplasms;0;1;NA;7283;3725;7846;203068; ; ; ; ; ; ; ; ; ; ; ; ; ; ; ; ; ; ; ; ; ;"""Vinblastine Sulfate Injection is indicated in the palliative treatment of the following: I. Frequently Responsive Malignancies Generalized Hodgkins disease (Stages III and IV, Ann Arbor modification of Rye staging system) Lymphocytic lymphoma (nodular and diffuse, poorly and well differentiated) Histiocytic lymphoma Mycosis fungoides (advanced stages) Advanced carcinoma of the testis Kaposis sarcoma Letterer-Siwe disease (histiocytosis X) II. Less Frequently Responsive Malignancies Choriocarcinoma resistant to other chemotherapeutic agents Carcinoma of the breast, unresponsive to appropriate endocrine surgery and hormonal therapy Current principles of chemotherapy for many types of cancer include the concurrent administration of several antineoplastic agents. For enhanced therapeutic effect without additive toxicity, agents with different dose-limiting clinical toxicities and different mechanisms of action are generally selected. Therefore, although vinblastine sulfate is effective as a single agent in the aforementioned indications, it is usually administered in combination with other antineoplastic drugs. Such combination therapy produces a greater percentage of response than does a single-agent regimen. These principles have been applied, for example, in the chemotherapy of Hodgkins disease. Vinblastine sulfate has been shown to be one of the most effective single agents for the treatment of Hodgkins disease. Advanced Hodgkins disease has also been successfully treated with several multiple-drug regimens that included vinblastine sulfate. Patients who had relapses after treatment with the MOPP program mechlorethamine hydrochloride (nitrogen mustard), vincristine sulfate, prednisone and procarbazinehave likewise responded to combination-drug therapy that included vinblastine sulfate. A protocol using cyclophosphamide in place of nitrogen mustard and vinblastine sulfate instead of vincristine sulfate is an alternative therapy for previously untreated patients with advanced Hodgkins disease. Advanced testicular germinal-cell cancers (embryonal carcinoma, teratocarcinoma and choriocarcinoma) are sensitive to vinblastine sulfate alone, but better clinical results are achieved when vinblastine sulfate is administered concomitantly with other antineoplastic agents. The effect of bleomycin is significantly enhanced if vinblastine sulfate is administered six to eight hours prior to the administration of bleomycin"DB00571;Propranolol;arrhythmias cardiac;0;1;NA;155;153;3351;154;3350; ; ; ; ; ; ; ; ; ; ; ; ; ; ; ; ; ; ; ; ;Propranolol hydrochloride tablets are indicated in the management of hypertension. They may be used alone or used in combination with other antihypertensive agents, particularly a thiazide diuretic. Propranolol hydrochloride tablets are not indicated in the management of hypertensive emergencies. Propranolol hydrochloride tablets are indicated to decrease angina frequency and increase exercise tolerance in patients with angina pectoris. Propranolol hydrochloride tablets are indicated to control ventricular rate in patients with atrial fibrillation and a rapid ventricular response. Propranolol hydrochloride tablets are indicated to reduce cardiovascular mortality in patients who have survived the acute phase of myocardial infarction and are clinically stable. Propranolol hydrochloride tablets are indicated for the prophylaxis of common migraine headache. The efficacy of propranolol in the treatment of a migraine attack that has started has not been established, and propranolol is not indicated for such use. Propranolol hydrochloride tablets are indicated in the management of familial or hereditary essential tremor. Familial or essential tremor consists of involuntary, rhythmic, oscillatory movements, usually limited to the upper limbs. It is absent at rest, but occurs when the limb is held in a fixed posture or position against gravity and during active movement. Propranolol hydrochloride tablets, USP causes a reduction in the tremor amplitude but not in the tremor frequency. Propranolol hydrochloride tablets are not indicated for the treatment of tremor associated with Parkinsonism. Propranolol hydrochloride tablets improve NYHA functional class in symptomatic patients with hypertrophic subaortic stenosis. Propranolol hydrochloride tablets are indicated as an adjunct to alpha-adrenergic blockade to control blood pressure and reduce symptoms of catecholamine-secreting tumors.DB00572;Atropine;asthma;0;0;NA;1133;1129;1128;1131;1132; ; ; ; ; ; ; ; ; ; ; ; ; ; ; ; ; ; ; ; ;For mydriasis and/or cycloplegia. For cycloplegic refraction, for pupillary dilation desired in inflammatory conditions of the iris and uveal tract.DB00584;Enalapril;kidney diseases;0;0;NA;1636; ; ; ; ; ; ; ; ; ; ; ; ; ; ; ; ; ; ; ; ; ; ; ; ;Enalapril maleate is indicated for the treatment of hypertension. Enalapril maleate is effective alone or in combination with other antihypertensive agents, especially thiazide-type diuretics. The blood pressure lowering effects of enalapril maleate and thiazides are approximately additive. Enalapril maleate is indicated for the treatment of symptomatic congestive heart failure, usually in combination with diuretics and digitalis. In these patients enalapril maleate improves symptoms, increases survival, and decreases the frequency of hospitalization (see CLINICAL PHARMACOLOGY, for details and limitations of survival trials). In clinically stable asymptomatic patients with left ventricular dysfunction (ejection fraction 35 percent), enalapril maleate decreases the rate of development of overt heart failure and decreases the incidence of hospitalization for heart failure. (See CLINICAL PHARMACOLOGY, for details and limitations of survival trials.) In using enalapril maleate, consideration should be given to the fact that another angiotensin converting enzyme inhibitor, captopril, has caused agranulocytosis, particularly in patients with renal impairment or collagen vascular disease, and that available data are insufficient to show that enalapril maleate does not have a similar risk. (See WARNINGS.) In considering use of enalapril maleate, it should be noted that in controlled clinical trials ACE inhibitors have an effect on blood pressure that is less in black patients than in non-blacks. In addition, it should be noted that black patients receiving ACE inhibitors have been reported to have a higher incidence of angioedema compared to non-blacks. (See WARNINGS, .)DB00586;Diclofenac;arthritis;1;1;0,247706;3786;3785;41;5742;5743;240;5320;6329; ; ; ; ; ; ; ; ; ; ; ; ; ; ; ; ; ;Carefully consider the potential benefits and risks of diclofenac sodium delayed-release tablets and other treatment options before deciding to use diclofenac. Use the lowest effective dose for the shortest duration consistent with individual patient treatment goals (see WARNINGS). Diclofenac is indicated: For relief of the signs and symptoms of osteoarthritis For relief of the signs and symptoms of rheumatoid arthritis For acute or long-term use in the relief of signs and symptoms of ankylosing spondylitisDB00588;Fluticasone Propionate;asthma;0;0;0;2908;5241;4306;5321; ; ; ; ; ; ; ; ; ; ; ; ; ; ; ; ; ; ; ; ; ;Fluticasone Propionate Nasal Spray, USP, is indicated for the management of the nasal symptoms of seasonal and perennial allergic and nonallergic rhinitis in adults and pediatric patients 4 years of age and older. Safety and effectiveness of Fluticasone Propionate Nasal Spray, USP, in children below 4 years of age have not been adequately established.DB00600;Monobenzone;hypopigmentation;0;1;NA;7299; ; ; ; ; ; ; ; ; ; ; ; ; ; ; ; ; ; ; ; ; ; ; ; ;"""Benoquin Cream 20% is indicated for final depigmentation in extensive Vitiligo. Benoquin Cream 20% is applied topically to permanently depigment normal skin surrounding vitiliginous lesions in patients with disseminated (greater than 50 percent of body surface area) idiopathic vitiligo. Benoquin Cream 20% is not recommended in freckling"DB00603;Medroxyprogesterone;breast neoplasms;0;0;0,909091;2099;5241; ; ; ; ; ; ; ; ; ; ; ; ; ; ; ; ; ; ; ; ; ; ; ;Medroxyprogesterone Acetate Tablets USP are a progestin indicated for the treatment of secondary amenorrhea and abnormal uterine bleeding due to hormonal imbalance in the absence of organic pathology, such as fibroids or uterine cancer. Medroxyprogesterone Acetate Tablets USP are also indicated to reduce the incidence of endometrial hyperplasia in nonhysterectomized postmenopausal women receiving daily oral conjugated estrogens 0.625 mg tablets.DB00605;Sulindac;arthritis;1;1;0;5742;5743;5595;231;5467; ; ; ; ; ; ; ; ; ; ; ; ; ; ; ; ; ; ; ; ;Carefully consider the potential benefits and risks of sulindac and other treatment options before deciding to use sulindac. Use the lowest effective dose for the shortest duration consistent with individual patient treatment goals (see WARNINGS). Sulindac tablets are indicated for acute long-term use in the relief of signs and symptoms of the following: Osteoarthritis Rheumatoid arthritis* Ankylosing spondylitis Acute painful shoulder (Acute subacromial bursitis/supraspinatus tendinitis) Acute gouty arthritisDB00608;Chloroquine;arthritis rheumatoid;0;0;NA;7124;54106;2939; ; ; ; ; ; ; ; ; ; ; ; ; ; ; ; ; ; ; ; ; ; ;Chloroquine phosphate tablets are indicated for the suppressive treatment and for acute attacks of malaria due to P. vivax, P.malariae, P. ovale, and susceptible strains of P. falciparum. The drug is also indicated for the treatment of extraintestinal amebiasis. Chloroquine phosphate tablets does not prevent relapses in patients with vivax or malariae malaria because it is not effective against exoerythrocytic forms of the parasite, nor will it prevent vivax or malariae infection when administered as a prophylactic. It is highly effective as a suppressive agent in patients with vivax or malariae malaria, in terminating acute attacks, and significantly lengthening the interval between treatment and relapse. In patients with falciparum malaria it abolishes the acute attack and effects complete cure of the infection, unless due to a resistant strain of P. falciparum.DB00615;Rifabutin;mycobacterium infections;0;1;NA;3320;7184; ; ; ; ; ; ; ; ; ; ; ; ; ; ; ; ; ; ; ; ; ; ; ;Rifabutin Capsules are indicated for the prevention of disseminated Mycobacterium avium complex (MAC) disease in patients with advanced HIV infection.DB00619;Imatinib;gastrointestinal neoplasms;0;1;NA;1436;25;780;3815;4914;5156;5159; ; ; ; ; ; ; ; ; ; ; ; ; ; ; ; ; ; ;Gleevec is a kinase inhibitor indicated for the treatment of: Newly diagnosed adult and pediatric patients with Philadelphia chromosome positive chronic myeloid leukemia (Ph+ CML) in chronic phase (1.1) Patients with Philadelphia chromosome positive chronic myeloid leukemia (Ph+ CML) in blast crisis (BC), accelerated phase (AP), or in chronic phase (CP) after failure of interferon-alpha therapy (1.2) Adult patients with relapsed or refractory Philadelphia chromosome positive acute lymphoblastic leukemia (Ph+ ALL) (1.3) Pediatric patients with newly diagnosed Philadelphia chromosome positive acute lymphoblastic leukemia (Ph+ ALL) in combination with chemotherapy (1.4) Adult patients with myelodysplastic/myeloproliferative diseases (MDS/MPD) associated with PDGFR (platelet-derived growth factor receptor) gene re-arrangements (1.5) Adult patients with aggressive systemic mastocytosis (ASM) without the D816V c-Kit mutation or with c-Kit mutational status unknown (1.6) Adult patients with hypereosinophilic syndrome (HES) and/or chronic eosinophilic leukemia (CEL) who have the FIP1L1-PDGFR fusion kinase (mutational analysis or FISH demonstration of CHIC2 allele deletion) and for patients with HES and/or CEL who are FIP1L1-PDGFR fusion kinase negative or unknown (1.7) Adult patients with unresectable, recurrent and/or metastatic dermatofibrosarcoma protuberans (DFSP) (1.8) Patients with Kit (CD117) positive unresectable and/or metastatic malignant gastrointestinal stromal tumors (GIST) (1.9) Adjuvant treatment of adult patients following resection of Kit (CD117) positive GIST (1.10)