megasphaera elsdenii;4676904;['Bacterium'];is location of;"=HYPERLINK(""http://www.ncbi.nlm.nih.gov/pubmed/453682"")";;;endotoxins;325567;['Carbohydrate', 'Lipid', 'Hazardous or Poisonous Substance'];6917;produces, is location of, affects, does not affect, is part of, augments;"=HYPERLINK(""http://www.ncbi.nlm.nih.gov/pubmed/23091155"")";"=HYPERLINK(""http://www.ncbi.nlm.nih.gov/pubmed/24548752"")";"=HYPERLINK(""http://www.ncbi.nlm.nih.gov/pubmed/16706830"")";intestines;649446;['Body Part, Organ, or Organ Component'];2,0;Euretos, Pubmed;4;American journal of veterinary research;453682;Euretos, Euretos, Euretos, Euretos, Euretos, Euretos;4, 4, 4, 4, 4, 4;Poultry science, Journal of ethnopharmacology, Journal of gastroenterology and hepatology, Alcoholism, clinical and experimental research, Surgery, gynecology & obstetrics, The Yale journal of biology and medicine;23091155, 24548752, 16706830, 10776683, 2902695, 9626760
clostridium tetani;330973;['Bacterium', 'Species'];is location of;"=HYPERLINK(""http://www.ncbi.nlm.nih.gov/pubmed/7893219"")";;;botulinum toxins;931363;['Amino Acid, Peptide, or Protein', 'Pharmacologic Substance', 'Hazardous or Poisonous Substance'];2357;affects, is location of, produces;"=HYPERLINK(""http://www.ncbi.nlm.nih.gov/pubmed/78045"")";"=HYPERLINK(""http://www.ncbi.nlm.nih.gov/pubmed/6197380"")";;intestines;649446;['Body Part, Organ, or Organ Component'];2,0;Euretos, Pubmed;4;Arquivos de neuro-psiquiatria;7893219;Euretos, Euretos, Euretos;4, 4;Lancet (London, England), Infection and immunity;78045, 6197380
clostridium tetani;330973;['Bacterium', 'Species'];is location of;"=HYPERLINK(""http://www.ncbi.nlm.nih.gov/pubmed/13289310"")";;;neurotoxins;523988;['Chemical Viewed Structurally', 'Hazardous or Poisonous Substance'];2391;affects, is location of;"=HYPERLINK(""http://www.ncbi.nlm.nih.gov/pubmed/12815802"")";"=HYPERLINK(""http://www.ncbi.nlm.nih.gov/pubmed/10456920"")";;intestines;649446;['Body Part, Organ, or Organ Component'];2,0;Euretos, Pubmed;4;Pharmacological reviews;13289310;Euretos, Euretos;4, 4;Folia medica Cracoviensia, Infection and immunity;12815802, 10456920
clostridium tetani;330973;['Bacterium', 'Species'];is part of;"=HYPERLINK(""http://www.ncbi.nlm.nih.gov/pubmed/12911336"")";;;virulence factors;301050;['Organic Chemical', 'Biologically Active Substance', 'Hazardous or Poisonous Substance'];4101;affects, produces, is location of, is part of;"=HYPERLINK(""http://www.ncbi.nlm.nih.gov/pubmed/20637130"")";"=HYPERLINK(""http://www.ncbi.nlm.nih.gov/pubmed/26969700"")";"=HYPERLINK(""http://www.ncbi.nlm.nih.gov/pubmed/7535283"")";intestines;649446;['Body Part, Organ, or Organ Component'];2,0;Euretos, Pubmed;4;Biotechnology and applied biochemistry;12911336;Euretos, Euretos, Euretos, Euretos;4, 4, 4, 4;BMC microbiology, Applied and environmental microbiology, Gut, Molecular microbiology;20637130, 26969700, 7535283, 12180927
clostridium tetani;330973;['Bacterium', 'Species'];is location of, produces, is part of;"=HYPERLINK(""http://www.ncbi.nlm.nih.gov/pubmed/1874121"")";"=HYPERLINK(""http://www.ncbi.nlm.nih.gov/pubmed/14931885"")";"=HYPERLINK(""http://www.ncbi.nlm.nih.gov/pubmed/14314102"")";toxin;2274712;['Biologically Active Substance', 'Hazardous or Poisonous Substance'];11266;is part of, produces, affects, disrupts, does not affect, is location of;"=HYPERLINK(""http://www.ncbi.nlm.nih.gov/pubmed/26518156"")";"=HYPERLINK(""http://www.ncbi.nlm.nih.gov/pubmed/26574895"")";"=HYPERLINK(""http://www.ncbi.nlm.nih.gov/pubmed/6673415"")";intestines;649446;['Body Part, Organ, or Organ Component'];2,0;Euretos, Euretos, Euretos, Pubmed, Pubmed, Pubmed;4, 4, 4;Disease-a-month : DM, Vojnosanitetski pregled, Surgery, gynecology & obstetrics;1874121, 14931885, 14314102;Euretos, Euretos, Euretos, Euretos, Euretos, Euretos;4, 4, 4, 4, 4, 4;BMC microbiology, Hormone molecular biology and clinical investigation, Zentralblatt fur Bakteriologie, Mikrobiologie, und Hygiene. Series A, Medical microbiology, infectious diseases, virology, parasitology, Reviews of infectious diseases, Microbiology and immunology, Infection and immunity;26518156, 26574895, 6673415, 399372, 6306410, 6347898
proteus mirabilis;943113;['Bacterium', 'Species'];is location of, is part of;"=HYPERLINK(""http://www.ncbi.nlm.nih.gov/pubmed/4613972"")";"=HYPERLINK(""http://www.ncbi.nlm.nih.gov/pubmed/6278022"")";;endotoxins;325567;['Carbohydrate', 'Lipid', 'Hazardous or Poisonous Substance'];6917;is associated with;"=HYPERLINK(""http://www.ncbi.nlm.nih.gov/pubmed/9740515"")";;;bacterial vaginosis;789617;['Disease or Syndrome'];2,0;Euretos, Euretos, Pubmed, Pubmed;4, 4;Medycyna doswiadczalna i mikrobiologia, Journal of immunology (Baltimore, Md. : 1950);4613972, 6278022;Euretos;4;Acta obstetricia et gynecologica Scandinavica;9740515
megasphaera elsdenii;4676904;['Bacterium'];is location of;"=HYPERLINK(""http://www.ncbi.nlm.nih.gov/pubmed/453682"")";;;endotoxins;325567;['Carbohydrate', 'Lipid', 'Hazardous or Poisonous Substance'];6917;is associated with;"=HYPERLINK(""http://www.ncbi.nlm.nih.gov/pubmed/9740515"")";;;bacterial vaginosis;789617;['Disease or Syndrome'];2,0;Euretos, Pubmed;4;American journal of veterinary research;453682;Euretos;4;Acta obstetricia et gynecologica Scandinavica;9740515
proteus mirabilis;943113;['Bacterium', 'Species'];produces, is location of, is part of;"=HYPERLINK(""http://www.ncbi.nlm.nih.gov/pubmed/24771125"")";"=HYPERLINK(""http://www.ncbi.nlm.nih.gov/pubmed/17005777"")";"=HYPERLINK(""http://www.ncbi.nlm.nih.gov/pubmed/12488561"")";virulence factors;301050;['Organic Chemical', 'Biologically Active Substance', 'Hazardous or Poisonous Substance'];4101;affects, augments;"=HYPERLINK(""http://www.ncbi.nlm.nih.gov/pubmed/23955529"")";"=HYPERLINK(""http://www.ncbi.nlm.nih.gov/pubmed/26494209"")";;bacterial adhesion;1148161;['Organism Function'];2,0;Euretos, Euretos, Euretos, Pubmed, Pubmed, Pubmed;4, 4, 4;Antonie van Leeuwenhoek, Journal of medical microbiology, Journal of medical microbiology;24771125, 17005777, 12488561;Euretos, Euretos;4, 4;Archivum immunologiae et therapiae experimentalis, Antonie van Leeuwenhoek;23955529, 26494209
clostridium septicum;594669;['Bacterium', 'Species'];is part of;"=HYPERLINK(""http://www.ncbi.nlm.nih.gov/pubmed/17128973"")";;;virulence factors;301050;['Organic Chemical', 'Biologically Active Substance', 'Hazardous or Poisonous Substance'];4101;affects, augments;"=HYPERLINK(""http://www.ncbi.nlm.nih.gov/pubmed/23955529"")";"=HYPERLINK(""http://www.ncbi.nlm.nih.gov/pubmed/26494209"")";;bacterial adhesion;1148161;['Organism Function'];2,0;Euretos, Pubmed;4;Biochemistry;17128973;Euretos, Euretos;4, 4;Archivum immunologiae et therapiae experimentalis, Antonie van Leeuwenhoek;23955529, 26494209
clostridium tetani;330973;['Bacterium', 'Species'];is part of;"=HYPERLINK(""http://www.ncbi.nlm.nih.gov/pubmed/12911336"")";;;virulence factors;301050;['Organic Chemical', 'Biologically Active Substance', 'Hazardous or Poisonous Substance'];4101;affects, augments;"=HYPERLINK(""http://www.ncbi.nlm.nih.gov/pubmed/23955529"")";"=HYPERLINK(""http://www.ncbi.nlm.nih.gov/pubmed/26494209"")";;bacterial adhesion;1148161;['Organism Function'];2,0;Euretos, Pubmed;4;Biotechnology and applied biochemistry;12911336;Euretos, Euretos;4, 4;Archivum immunologiae et therapiae experimentalis, Antonie van Leeuwenhoek;23955529, 26494209
clostridium tetani;330973;['Bacterium', 'Species'];is part of;"=HYPERLINK(""http://www.ncbi.nlm.nih.gov/pubmed/4931217"")";;;leukotoxin;1294937;['Pharmacologic Substance', 'Biologically Active Substance', 'Hazardous or Poisonous Substance'];705;affects;"=HYPERLINK(""http://www.ncbi.nlm.nih.gov/pubmed/14527274"")";;;bacterial adhesion;1148161;['Organism Function'];2,0;Euretos, Pubmed;4;Mikrobiolohichnyi zhurnal;4931217;Euretos;4;Annual review of microbiology;14527274
proteus mirabilis;943113;['Bacterium', 'Species'];is location of, is part of;"=HYPERLINK(""http://www.ncbi.nlm.nih.gov/pubmed/4613972"")";"=HYPERLINK(""http://www.ncbi.nlm.nih.gov/pubmed/6278022"")";;endotoxins;325567;['Carbohydrate', 'Lipid', 'Hazardous or Poisonous Substance'];6917;causes, is associated with;"=HYPERLINK(""http://www.ncbi.nlm.nih.gov/pubmed/2784116"")";;;anemia;835245;['Finding', 'Disease or Syndrome'];2,0;Euretos, Euretos, Pubmed, Pubmed;4, 4;Medycyna doswiadczalna i mikrobiologia, Journal of immunology (Baltimore, Md. : 1950);4613972, 6278022;Euretos, Euretos;4;FASEB journal : official publication of the Federation of American Societies for Experimental Biology;2784116
proteus mirabilis;943113;['Bacterium', 'Species'];produces, is location of, is part of;"=HYPERLINK(""http://www.ncbi.nlm.nih.gov/pubmed/24771125"")";"=HYPERLINK(""http://www.ncbi.nlm.nih.gov/pubmed/17005777"")";"=HYPERLINK(""http://www.ncbi.nlm.nih.gov/pubmed/12488561"")";virulence factors;301050;['Organic Chemical', 'Biologically Active Substance', 'Hazardous or Poisonous Substance'];4101;treats, is associated with;"=HYPERLINK(""http://www.ncbi.nlm.nih.gov/pubmed/20620527"")";"=HYPERLINK(""http://www.ncbi.nlm.nih.gov/pubmed/1118689"")";;anemia;835245;['Finding', 'Disease or Syndrome'];2,0;Euretos, Euretos, Euretos, Pubmed, Pubmed, Pubmed;4, 4, 4;Antonie van Leeuwenhoek, Journal of medical microbiology, Journal of medical microbiology;24771125, 17005777, 12488561;Euretos, Euretos;4, 4;Transplantation proceedings, Reumatologia;20620527, 1118689
proteus mirabilis;943113;['Bacterium', 'Species'];is part of;"=HYPERLINK(""http://www.ncbi.nlm.nih.gov/pubmed/12101306"")";;;toxin;2274712;['Biologically Active Substance', 'Hazardous or Poisonous Substance'];11266;does not cause, treats, causes, is associated with;"=HYPERLINK(""http://www.ncbi.nlm.nih.gov/pubmed/23343547"")";"=HYPERLINK(""http://www.ncbi.nlm.nih.gov/pubmed/19868545"")";"=HYPERLINK(""http://www.ncbi.nlm.nih.gov/pubmed/2051730"")";anemia;835245;['Finding', 'Disease or Syndrome'];2,0;Euretos, Pubmed;4;Microbiology (Reading, England);12101306;Euretos, Euretos, Euretos, Euretos;4, 4, 4, 4;Blood purification, The Journal of experimental medicine, Kidney international, Nephrologie;23343547, 19868545, 2051730, 7301014
clostridium septicum;594669;['Bacterium', 'Species'];is part of;"=HYPERLINK(""http://www.ncbi.nlm.nih.gov/pubmed/17128973"")";;;virulence factors;301050;['Organic Chemical', 'Biologically Active Substance', 'Hazardous or Poisonous Substance'];4101;treats, is associated with;"=HYPERLINK(""http://www.ncbi.nlm.nih.gov/pubmed/20620527"")";"=HYPERLINK(""http://www.ncbi.nlm.nih.gov/pubmed/1118689"")";;anemia;835245;['Finding', 'Disease or Syndrome'];2,0;Euretos, Pubmed;4;Biochemistry;17128973;Euretos, Euretos;4, 4;Transplantation proceedings, Reumatologia;20620527, 1118689
clostridium septicum;594669;['Bacterium', 'Species'];is part of, is location of, produces;"=HYPERLINK(""http://www.ncbi.nlm.nih.gov/pubmed/14715670"")";"=HYPERLINK(""http://www.ncbi.nlm.nih.gov/pubmed/13582143"")";"=HYPERLINK(""http://www.ncbi.nlm.nih.gov/pubmed/13598715"")";toxin;2274712;['Biologically Active Substance', 'Hazardous or Poisonous Substance'];11266;does not cause, causes, treats, is associated with;"=HYPERLINK(""http://www.ncbi.nlm.nih.gov/pubmed/23343547"")";"=HYPERLINK(""http://www.ncbi.nlm.nih.gov/pubmed/19868545"")";"=HYPERLINK(""http://www.ncbi.nlm.nih.gov/pubmed/2051730"")";anemia;835245;['Finding', 'Disease or Syndrome'];2,0;Euretos, Euretos, Euretos, Pubmed, Pubmed, Pubmed;4, 4, 4;The Journal of biological chemistry, Zhurnal mikrobiologii, epidemiologii, i immunobiologii, Journal of bacteriology;14715670, 13582143, 13598715;Euretos, Euretos, Euretos, Euretos;4, 4, 4, 4;Blood purification, The Journal of experimental medicine, Kidney international, Nephrologie;23343547, 19868545, 2051730, 7301014
megasphaera elsdenii;4676904;['Bacterium'];is location of;"=HYPERLINK(""http://www.ncbi.nlm.nih.gov/pubmed/453682"")";;;endotoxins;325567;['Carbohydrate', 'Lipid', 'Hazardous or Poisonous Substance'];6917;causes, is associated with;"=HYPERLINK(""http://www.ncbi.nlm.nih.gov/pubmed/2784116"")";;;anemia;835245;['Finding', 'Disease or Syndrome'];2,0;Euretos, Pubmed;4;American journal of veterinary research;453682;Euretos, Euretos;4;FASEB journal : official publication of the Federation of American Societies for Experimental Biology;2784116
clostridium tetani;330973;['Bacterium', 'Species'];is part of;"=HYPERLINK(""http://www.ncbi.nlm.nih.gov/pubmed/12911336"")";;;virulence factors;301050;['Organic Chemical', 'Biologically Active Substance', 'Hazardous or Poisonous Substance'];4101;treats, is associated with;"=HYPERLINK(""http://www.ncbi.nlm.nih.gov/pubmed/20620527"")";"=HYPERLINK(""http://www.ncbi.nlm.nih.gov/pubmed/1118689"")";;anemia;835245;['Finding', 'Disease or Syndrome'];2,0;Euretos, Pubmed;4;Biotechnology and applied biochemistry;12911336;Euretos, Euretos;4, 4;Transplantation proceedings, Reumatologia;20620527, 1118689
clostridium tetani;330973;['Bacterium', 'Species'];is location of, produces, is part of;"=HYPERLINK(""http://www.ncbi.nlm.nih.gov/pubmed/1874121"")";"=HYPERLINK(""http://www.ncbi.nlm.nih.gov/pubmed/14931885"")";"=HYPERLINK(""http://www.ncbi.nlm.nih.gov/pubmed/14314102"")";toxin;2274712;['Biologically Active Substance', 'Hazardous or Poisonous Substance'];11266;does not cause, causes, treats, is associated with;"=HYPERLINK(""http://www.ncbi.nlm.nih.gov/pubmed/23343547"")";"=HYPERLINK(""http://www.ncbi.nlm.nih.gov/pubmed/19868545"")";"=HYPERLINK(""http://www.ncbi.nlm.nih.gov/pubmed/2051730"")";anemia;835245;['Finding', 'Disease or Syndrome'];2,0;Euretos, Euretos, Euretos, Pubmed, Pubmed, Pubmed;4, 4, 4;Disease-a-month : DM, Vojnosanitetski pregled, Surgery, gynecology & obstetrics;1874121, 14931885, 14314102;Euretos, Euretos, Euretos, Euretos;4, 4, 4, 4;Blood purification, The Journal of experimental medicine, Kidney international, Nephrologie;23343547, 19868545, 2051730, 7301014
proteus mirabilis;943113;['Bacterium', 'Species'];is location of, is part of;"=HYPERLINK(""http://www.ncbi.nlm.nih.gov/pubmed/4613972"")";"=HYPERLINK(""http://www.ncbi.nlm.nih.gov/pubmed/6278022"")";;endotoxins;325567;['Carbohydrate', 'Lipid', 'Hazardous or Poisonous Substance'];6917;is associated with;"=HYPERLINK(""http://www.ncbi.nlm.nih.gov/pubmed/6493204"")";;;intestinal diseases;396567;['Finding', 'Disease or Syndrome'];2,0;Euretos, Euretos, Pubmed, Pubmed;4, 4;Medycyna doswiadczalna i mikrobiologia, Journal of immunology (Baltimore, Md. : 1950);4613972, 6278022;Euretos;4;Modern veterinary practice;6493204
proteus mirabilis;943113;['Bacterium', 'Species'];produces, is location of, is part of;"=HYPERLINK(""http://www.ncbi.nlm.nih.gov/pubmed/24771125"")";"=HYPERLINK(""http://www.ncbi.nlm.nih.gov/pubmed/17005777"")";"=HYPERLINK(""http://www.ncbi.nlm.nih.gov/pubmed/12488561"")";virulence factors;301050;['Organic Chemical', 'Biologically Active Substance', 'Hazardous or Poisonous Substance'];4101;is associated with;"=HYPERLINK(""http://www.ncbi.nlm.nih.gov/pubmed/7650061"")";;;intestinal diseases;396567;['Finding', 'Disease or Syndrome'];2,0;Euretos, Euretos, Euretos, Pubmed, Pubmed, Pubmed;4, 4, 4;Antonie van Leeuwenhoek, Journal of medical microbiology, Journal of medical microbiology;24771125, 17005777, 12488561;Euretos;4;Journal of cellular physiology;7650061
proteus mirabilis;943113;['Bacterium', 'Species'];is part of;"=HYPERLINK(""http://www.ncbi.nlm.nih.gov/pubmed/12101306"")";;;toxin;2274712;['Biologically Active Substance', 'Hazardous or Poisonous Substance'];11266;is associated with, causes;"=HYPERLINK(""http://www.ncbi.nlm.nih.gov/pubmed/12125238"")";"=HYPERLINK(""http://www.ncbi.nlm.nih.gov/pubmed/7005079"")";;intestinal diseases;396567;['Finding', 'Disease or Syndrome'];2,0;Euretos, Pubmed;4;Microbiology (Reading, England);12101306;Euretos, Euretos;4, 4;Schweizer Archiv fur Tierheilkunde, Immunitat und Infektion;12125238, 7005079
clostridium septicum;594669;['Bacterium', 'Species'];is part of;"=HYPERLINK(""http://www.ncbi.nlm.nih.gov/pubmed/17128973"")";;;virulence factors;301050;['Organic Chemical', 'Biologically Active Substance', 'Hazardous or Poisonous Substance'];4101;is associated with;"=HYPERLINK(""http://www.ncbi.nlm.nih.gov/pubmed/7650061"")";;;intestinal diseases;396567;['Finding', 'Disease or Syndrome'];2,0;Euretos, Pubmed;4;Biochemistry;17128973;Euretos;4;Journal of cellular physiology;7650061
clostridium septicum;594669;['Bacterium', 'Species'];is part of, is location of, produces;"=HYPERLINK(""http://www.ncbi.nlm.nih.gov/pubmed/14715670"")";"=HYPERLINK(""http://www.ncbi.nlm.nih.gov/pubmed/13582143"")";"=HYPERLINK(""http://www.ncbi.nlm.nih.gov/pubmed/13598715"")";toxin;2274712;['Biologically Active Substance', 'Hazardous or Poisonous Substance'];11266;is associated with, causes;"=HYPERLINK(""http://www.ncbi.nlm.nih.gov/pubmed/12125238"")";"=HYPERLINK(""http://www.ncbi.nlm.nih.gov/pubmed/7005079"")";;intestinal diseases;396567;['Finding', 'Disease or Syndrome'];2,0;Euretos, Euretos, Euretos, Pubmed, Pubmed, Pubmed;4, 4, 4;The Journal of biological chemistry, Zhurnal mikrobiologii, epidemiologii, i immunobiologii, Journal of bacteriology;14715670, 13582143, 13598715;Euretos, Euretos;4, 4;Schweizer Archiv fur Tierheilkunde, Immunitat und Infektion;12125238, 7005079
megasphaera elsdenii;4676904;['Bacterium'];is location of;"=HYPERLINK(""http://www.ncbi.nlm.nih.gov/pubmed/453682"")";;;endotoxins;325567;['Carbohydrate', 'Lipid', 'Hazardous or Poisonous Substance'];6917;is associated with;"=HYPERLINK(""http://www.ncbi.nlm.nih.gov/pubmed/6493204"")";;;intestinal diseases;396567;['Finding', 'Disease or Syndrome'];2,0;Euretos, Pubmed;4;American journal of veterinary research;453682;Euretos;4;Modern veterinary practice;6493204
clostridium tetani;330973;['Bacterium', 'Species'];is part of;"=HYPERLINK(""http://www.ncbi.nlm.nih.gov/pubmed/12911336"")";;;virulence factors;301050;['Organic Chemical', 'Biologically Active Substance', 'Hazardous or Poisonous Substance'];4101;is associated with;"=HYPERLINK(""http://www.ncbi.nlm.nih.gov/pubmed/7650061"")";;;intestinal diseases;396567;['Finding', 'Disease or Syndrome'];2,0;Euretos, Pubmed;4;Biotechnology and applied biochemistry;12911336;Euretos;4;Journal of cellular physiology;7650061
clostridium tetani;330973;['Bacterium', 'Species'];is location of, produces, is part of;"=HYPERLINK(""http://www.ncbi.nlm.nih.gov/pubmed/1874121"")";"=HYPERLINK(""http://www.ncbi.nlm.nih.gov/pubmed/14931885"")";"=HYPERLINK(""http://www.ncbi.nlm.nih.gov/pubmed/14314102"")";toxin;2274712;['Biologically Active Substance', 'Hazardous or Poisonous Substance'];11266;is associated with, causes;"=HYPERLINK(""http://www.ncbi.nlm.nih.gov/pubmed/12125238"")";"=HYPERLINK(""http://www.ncbi.nlm.nih.gov/pubmed/7005079"")";;intestinal diseases;396567;['Finding', 'Disease or Syndrome'];2,0;Euretos, Euretos, Euretos, Pubmed, Pubmed, Pubmed;4, 4, 4;Disease-a-month : DM, Vojnosanitetski pregled, Surgery, gynecology & obstetrics;1874121, 14931885, 14314102;Euretos, Euretos;4, 4;Schweizer Archiv fur Tierheilkunde, Immunitat und Infektion;12125238, 7005079
clostridium tetani;330973;['Bacterium', 'Species'];is part of, interacts with, is location of, is associated with, interacts with, produces, is associated with;"=HYPERLINK(""http://www.ncbi.nlm.nih.gov/pubmed/23299659"")";"=HYPERLINK(""http://www.ncbi.nlm.nih.gov/pubmed/23314360"")";"=HYPERLINK(""http://www.ncbi.nlm.nih.gov/pubmed/9826344"")";tetanus toxin;172277;['Amino Acid, Peptide, or Protein', 'Hazardous or Poisonous Substance'];1076;is part of, is location of;"=HYPERLINK(""http://www.ncbi.nlm.nih.gov/pubmed/8387092"")";"=HYPERLINK(""http://www.ncbi.nlm.nih.gov/pubmed/7520374"")";;b-lymphocytes;40470;['Cell'];43,0;Euretos, Euretos, Euretos, Euretos, Euretos, SNMI, SNMI, Pubmed, Pubmed, Pubmed, Pubmed, LNC, SNMI, MEDCIN, LNC, SNMI, MSH;4, 4, 4, 4, 4, 4, 4, 4, 4, 4;Toxins, Journal of microbiology and biotechnology, Infection and immunity, The Journal of biological chemistry, umls, umls, umls, umls, umls, umls;23299659, 23314360, 9826344, 7829513, C0009064, C0009064, C0009064, C0039617, C0039617, C0039617;Euretos, Euretos;4, 4;Journal of immunology (Baltimore, Md. : 1950), Clinical immunology and immunopathology;8387092, 7520374
proteus mirabilis;943113;['Bacterium', 'Species'];is location of, is part of;"=HYPERLINK(""http://www.ncbi.nlm.nih.gov/pubmed/4613972"")";"=HYPERLINK(""http://www.ncbi.nlm.nih.gov/pubmed/6278022"")";;endotoxins;325567;['Carbohydrate', 'Lipid', 'Hazardous or Poisonous Substance'];6917;augments, produces, does not augment, is location of, is part of;"=HYPERLINK(""http://www.ncbi.nlm.nih.gov/pubmed/10865440"")";"=HYPERLINK(""http://www.ncbi.nlm.nih.gov/pubmed/11679322"")";"=HYPERLINK(""http://www.ncbi.nlm.nih.gov/pubmed/6970221"")";b-lymphocytes;40470;['Cell'];2,0;Euretos, Euretos, Pubmed, Pubmed;4, 4;Medycyna doswiadczalna i mikrobiologia, Journal of immunology (Baltimore, Md. : 1950);4613972, 6278022;Euretos, Euretos, Euretos, Euretos, Euretos;4, 4, 4, 4, 4;Medycyna doswiadczalna i mikrobiologia, Applied and environmental microbiology, Journal of immunology (Baltimore, Md. : 1950), Allergie und Immunologie, Experimental hematology;10865440, 11679322, 6970221, 135504, 239854
proteus mirabilis;943113;['Bacterium', 'Species'];produces, is location of, is part of;"=HYPERLINK(""http://www.ncbi.nlm.nih.gov/pubmed/24771125"")";"=HYPERLINK(""http://www.ncbi.nlm.nih.gov/pubmed/17005777"")";"=HYPERLINK(""http://www.ncbi.nlm.nih.gov/pubmed/12488561"")";virulence factors;301050;['Organic Chemical', 'Biologically Active Substance', 'Hazardous or Poisonous Substance'];4101;disrupts;"=HYPERLINK(""http://www.ncbi.nlm.nih.gov/pubmed/342413"")";;;b-lymphocytes;40470;['Cell'];2,0;Euretos, Euretos, Euretos, Pubmed, Pubmed, Pubmed;4, 4, 4;Antonie van Leeuwenhoek, Journal of medical microbiology, Journal of medical microbiology;24771125, 17005777, 12488561;Euretos;4;Infection and immunity;342413
proteus mirabilis;943113;['Bacterium', 'Species'];is part of;"=HYPERLINK(""http://www.ncbi.nlm.nih.gov/pubmed/12101306"")";;;toxin;2274712;['Biologically Active Substance', 'Hazardous or Poisonous Substance'];11266;is administered to, is part of, affects, is location of;"=HYPERLINK(""http://www.ncbi.nlm.nih.gov/pubmed/22069663"")";"=HYPERLINK(""http://www.ncbi.nlm.nih.gov/pubmed/2894201"")";"=HYPERLINK(""http://www.ncbi.nlm.nih.gov/pubmed/2952625"")";b-lymphocytes;40470;['Cell'];2,0;Euretos, Pubmed;4;Microbiology (Reading, England);12101306;Euretos, Euretos, Euretos, Euretos;4, 4, 4, 4;Toxins, Applied and environmental microbiology, Histochemistry, Zhurnal mikrobiologii, epidemiologii, i immunobiologii;22069663, 2894201, 2952625, 4218008
clostridium septicum;594669;['Bacterium', 'Species'];is part of;"=HYPERLINK(""http://www.ncbi.nlm.nih.gov/pubmed/17128973"")";;;virulence factors;301050;['Organic Chemical', 'Biologically Active Substance', 'Hazardous or Poisonous Substance'];4101;disrupts;"=HYPERLINK(""http://www.ncbi.nlm.nih.gov/pubmed/342413"")";;;b-lymphocytes;40470;['Cell'];2,0;Euretos, Pubmed;4;Biochemistry;17128973;Euretos;4;Infection and immunity;342413
clostridium septicum;594669;['Bacterium', 'Species'];is part of, is location of, produces;"=HYPERLINK(""http://www.ncbi.nlm.nih.gov/pubmed/14715670"")";"=HYPERLINK(""http://www.ncbi.nlm.nih.gov/pubmed/13582143"")";"=HYPERLINK(""http://www.ncbi.nlm.nih.gov/pubmed/13598715"")";toxin;2274712;['Biologically Active Substance', 'Hazardous or Poisonous Substance'];11266;is administered to, is part of, affects, is location of;"=HYPERLINK(""http://www.ncbi.nlm.nih.gov/pubmed/22069663"")";"=HYPERLINK(""http://www.ncbi.nlm.nih.gov/pubmed/2894201"")";"=HYPERLINK(""http://www.ncbi.nlm.nih.gov/pubmed/2952625"")";b-lymphocytes;40470;['Cell'];2,0;Euretos, Euretos, Euretos, Pubmed, Pubmed, Pubmed;4, 4, 4;The Journal of biological chemistry, Zhurnal mikrobiologii, epidemiologii, i immunobiologii, Journal of bacteriology;14715670, 13582143, 13598715;Euretos, Euretos, Euretos, Euretos;4, 4, 4, 4;Toxins, Applied and environmental microbiology, Histochemistry, Zhurnal mikrobiologii, epidemiologii, i immunobiologii;22069663, 2894201, 2952625, 4218008
megasphaera elsdenii;4676904;['Bacterium'];is location of;"=HYPERLINK(""http://www.ncbi.nlm.nih.gov/pubmed/453682"")";;;endotoxins;325567;['Carbohydrate', 'Lipid', 'Hazardous or Poisonous Substance'];6917;augments, produces, does not augment, is location of, is part of;"=HYPERLINK(""http://www.ncbi.nlm.nih.gov/pubmed/10865440"")";"=HYPERLINK(""http://www.ncbi.nlm.nih.gov/pubmed/11679322"")";"=HYPERLINK(""http://www.ncbi.nlm.nih.gov/pubmed/6970221"")";b-lymphocytes;40470;['Cell'];2,0;Euretos, Pubmed;4;American journal of veterinary research;453682;Euretos, Euretos, Euretos, Euretos, Euretos;4, 4, 4, 4, 4;Medycyna doswiadczalna i mikrobiologia, Applied and environmental microbiology, Journal of immunology (Baltimore, Md. : 1950), Allergie und Immunologie, Experimental hematology;10865440, 11679322, 6970221, 135504, 239854
clostridium tetani;330973;['Bacterium', 'Species'];is location of;"=HYPERLINK(""http://www.ncbi.nlm.nih.gov/pubmed/22977074"")";;;exotoxins;908286;['Hazardous or Poisonous Substance'];1202;is location of;"=HYPERLINK(""http://www.ncbi.nlm.nih.gov/pubmed/8446960"")";;;b-lymphocytes;40470;['Cell'];2,0;Euretos, Pubmed;4;Journal of medical microbiology;22977074;Euretos;4;Toxicon : official journal of the International Society on Toxinology;8446960
clostridium tetani;330973;['Bacterium', 'Species'];is part of;"=HYPERLINK(""http://www.ncbi.nlm.nih.gov/pubmed/15003646"")";;;tetanus toxin fragment c;864516;['Amino Acid, Peptide, or Protein', 'Hazardous or Poisonous Substance'];77;produces;"=HYPERLINK(""http://www.ncbi.nlm.nih.gov/pubmed/21565244"")";;;b-lymphocytes;40470;['Cell'];2,0;Euretos, Pubmed;4;Vaccine;15003646;Euretos;4;Vaccine;21565244
