clostridium tetani;330973;['Bacterium', 'Species'];is location of, produces, is part of;"=HYPERLINK(""http://www.ncbi.nlm.nih.gov/pubmed/1874121"")";"=HYPERLINK(""http://www.ncbi.nlm.nih.gov/pubmed/14931885"")";"=HYPERLINK(""http://www.ncbi.nlm.nih.gov/pubmed/14314102"")";toxin;2274712;['Biologically Active Substance', 'Hazardous or Poisonous Substance'];11266;is associated with, causes;"=HYPERLINK(""http://www.ncbi.nlm.nih.gov/pubmed/12125238"")";"=HYPERLINK(""http://www.ncbi.nlm.nih.gov/pubmed/7005079"")";;intestinal diseases;396567;['Finding', 'Disease or Syndrome'];2,0;Euretos, Euretos, Euretos, Pubmed, Pubmed, Pubmed;4, 4, 4;Disease-a-month : DM, Vojnosanitetski pregled, Surgery, gynecology & obstetrics;1874121, 14931885, 14314102;Euretos, Euretos;4, 4;Schweizer Archiv fur Tierheilkunde, Immunitat und Infektion;12125238, 7005079
clostridium tetani;330973;['Bacterium', 'Species'];interacts with, is part of, is location of, is associated with, interacts with, produces, is associated with;"=HYPERLINK(""http://www.ncbi.nlm.nih.gov/pubmed/23299659"")";"=HYPERLINK(""http://www.ncbi.nlm.nih.gov/pubmed/23314360"")";"=HYPERLINK(""http://www.ncbi.nlm.nih.gov/pubmed/9826344"")";tetanus toxin;172277;['Amino Acid, Peptide, or Protein', 'Hazardous or Poisonous Substance'];1076;is location of;"=HYPERLINK(""http://www.ncbi.nlm.nih.gov/pubmed/7997244"")";;;antigen-presenting cells;934406;['Cell', 'Cell Component'];43,0;Euretos, Euretos, Euretos, Euretos, Euretos, SNMI, SNMI, Pubmed, Pubmed, Pubmed, Pubmed, LNC, SNMI, MEDCIN, LNC, SNMI, MSH;4, 4, 4, 4, 4, 4, 4, 4, 4, 4;Toxins, Journal of microbiology and biotechnology, Infection and immunity, The Journal of biological chemistry, umls, umls, umls, umls, umls, umls;23299659, 23314360, 9826344, 7829513, C0009064, C0009064, C0009064, C0039617, C0039617, C0039617;Euretos;4;Molecular immunology;7997244
proteus mirabilis;943113;['Bacterium', 'Species'];is location of, is part of;"=HYPERLINK(""http://www.ncbi.nlm.nih.gov/pubmed/4613972"")";"=HYPERLINK(""http://www.ncbi.nlm.nih.gov/pubmed/6278022"")";;endotoxins;325567;['Carbohydrate', 'Lipid', 'Hazardous or Poisonous Substance'];6917;produces;"=HYPERLINK(""http://www.ncbi.nlm.nih.gov/pubmed/10930299"")";;;antigen-presenting cells;934406;['Cell', 'Cell Component'];2,0;Euretos, Euretos, Pubmed, Pubmed;4, 4;Medycyna doswiadczalna i mikrobiologia, Journal of immunology (Baltimore, Md. : 1950);4613972, 6278022;Euretos;4;Cytokine;10930299
proteus mirabilis;943113;['Bacterium', 'Species'];is part of;"=HYPERLINK(""http://www.ncbi.nlm.nih.gov/pubmed/12101306"")";;;toxin;2274712;['Biologically Active Substance', 'Hazardous or Poisonous Substance'];11266;is location of, is part of, is administered to;"=HYPERLINK(""http://www.ncbi.nlm.nih.gov/pubmed/9770520"")";"=HYPERLINK(""http://www.ncbi.nlm.nih.gov/pubmed/2037017"")";"=HYPERLINK(""http://www.ncbi.nlm.nih.gov/pubmed/1384422"")";antigen-presenting cells;934406;['Cell', 'Cell Component'];2,0;Euretos, Pubmed;4;Microbiology (Reading, England);12101306;Euretos, Euretos, Euretos;4, 4, 4;Proceedings of the National Academy of Sciences of the United States of America, European journal of immunology, Annals of neurology;9770520, 2037017, 1384422
clostridium septicum;594669;['Bacterium', 'Species'];is part of, is location of, produces;"=HYPERLINK(""http://www.ncbi.nlm.nih.gov/pubmed/14715670"")";"=HYPERLINK(""http://www.ncbi.nlm.nih.gov/pubmed/13582143"")";"=HYPERLINK(""http://www.ncbi.nlm.nih.gov/pubmed/13598715"")";toxin;2274712;['Biologically Active Substance', 'Hazardous or Poisonous Substance'];11266;is location of, is part of, is administered to;"=HYPERLINK(""http://www.ncbi.nlm.nih.gov/pubmed/9770520"")";"=HYPERLINK(""http://www.ncbi.nlm.nih.gov/pubmed/2037017"")";"=HYPERLINK(""http://www.ncbi.nlm.nih.gov/pubmed/1384422"")";antigen-presenting cells;934406;['Cell', 'Cell Component'];2,0;Euretos, Euretos, Euretos, Pubmed, Pubmed, Pubmed;4, 4, 4;The Journal of biological chemistry, Zhurnal mikrobiologii, epidemiologii, i immunobiologii, Journal of bacteriology;14715670, 13582143, 13598715;Euretos, Euretos, Euretos;4, 4, 4;Proceedings of the National Academy of Sciences of the United States of America, European journal of immunology, Annals of neurology;9770520, 2037017, 1384422
megasphaera elsdenii;4676904;['Bacterium'];is location of;"=HYPERLINK(""http://www.ncbi.nlm.nih.gov/pubmed/453682"")";;;endotoxins;325567;['Carbohydrate', 'Lipid', 'Hazardous or Poisonous Substance'];6917;produces;"=HYPERLINK(""http://www.ncbi.nlm.nih.gov/pubmed/10930299"")";;;antigen-presenting cells;934406;['Cell', 'Cell Component'];2,0;Euretos, Pubmed;4;American journal of veterinary research;453682;Euretos;4;Cytokine;10930299
clostridium tetani;330973;['Bacterium', 'Species'];is location of;"=HYPERLINK(""http://www.ncbi.nlm.nih.gov/pubmed/22977074"")";;;exotoxins;908286;['Hazardous or Poisonous Substance'];1202;is location of;"=HYPERLINK(""http://www.ncbi.nlm.nih.gov/pubmed/1903675"")";;;antigen-presenting cells;934406;['Cell', 'Cell Component'];2,0;Euretos, Pubmed;4;Journal of medical microbiology;22977074;Euretos;4;Cellular immunology;1903675
clostridium tetani;330973;['Bacterium', 'Species'];is location of, produces, is part of;"=HYPERLINK(""http://www.ncbi.nlm.nih.gov/pubmed/1874121"")";"=HYPERLINK(""http://www.ncbi.nlm.nih.gov/pubmed/14931885"")";"=HYPERLINK(""http://www.ncbi.nlm.nih.gov/pubmed/14314102"")";toxin;2274712;['Biologically Active Substance', 'Hazardous or Poisonous Substance'];11266;is location of, is part of, is administered to;"=HYPERLINK(""http://www.ncbi.nlm.nih.gov/pubmed/9770520"")";"=HYPERLINK(""http://www.ncbi.nlm.nih.gov/pubmed/2037017"")";"=HYPERLINK(""http://www.ncbi.nlm.nih.gov/pubmed/1384422"")";antigen-presenting cells;934406;['Cell', 'Cell Component'];2,0;Euretos, Euretos, Euretos, Pubmed, Pubmed, Pubmed;4, 4, 4;Disease-a-month : DM, Vojnosanitetski pregled, Surgery, gynecology & obstetrics;1874121, 14931885, 14314102;Euretos, Euretos, Euretos;4, 4, 4;Proceedings of the National Academy of Sciences of the United States of America, European journal of immunology, Annals of neurology;9770520, 2037017, 1384422
proteus mirabilis;943113;['Bacterium', 'Species'];produces, is location of, is part of;"=HYPERLINK(""http://www.ncbi.nlm.nih.gov/pubmed/24771125"")";"=HYPERLINK(""http://www.ncbi.nlm.nih.gov/pubmed/17005777"")";"=HYPERLINK(""http://www.ncbi.nlm.nih.gov/pubmed/12488561"")";virulence factors;301050;['Organic Chemical', 'Biologically Active Substance', 'Hazardous or Poisonous Substance'];4101;affects;"=HYPERLINK(""http://www.ncbi.nlm.nih.gov/pubmed/25056968"")";;;adaptive immunity;1204394;['Physiologic Function'];2,0;Euretos, Euretos, Euretos, Pubmed, Pubmed, Pubmed;4, 4, 4;Antonie van Leeuwenhoek, Journal of medical microbiology, Journal of medical microbiology;24771125, 17005777, 12488561;Euretos;4;Proceedings of the National Academy of Sciences of the United States of America;25056968
clostridium septicum;594669;['Bacterium', 'Species'];is part of;"=HYPERLINK(""http://www.ncbi.nlm.nih.gov/pubmed/17128973"")";;;virulence factors;301050;['Organic Chemical', 'Biologically Active Substance', 'Hazardous or Poisonous Substance'];4101;affects;"=HYPERLINK(""http://www.ncbi.nlm.nih.gov/pubmed/25056968"")";;;adaptive immunity;1204394;['Physiologic Function'];2,0;Euretos, Pubmed;4;Biochemistry;17128973;Euretos;4;Proceedings of the National Academy of Sciences of the United States of America;25056968
clostridium tetani;330973;['Bacterium', 'Species'];is part of;"=HYPERLINK(""http://www.ncbi.nlm.nih.gov/pubmed/12911336"")";;;virulence factors;301050;['Organic Chemical', 'Biologically Active Substance', 'Hazardous or Poisonous Substance'];4101;affects;"=HYPERLINK(""http://www.ncbi.nlm.nih.gov/pubmed/25056968"")";;;adaptive immunity;1204394;['Physiologic Function'];2,0;Euretos, Pubmed;4;Biotechnology and applied biochemistry;12911336;Euretos;4;Proceedings of the National Academy of Sciences of the United States of America;25056968
clostridium tetani;330973;['Bacterium', 'Species'];interacts with, is part of, is location of, is associated with, interacts with, produces, is associated with;"=HYPERLINK(""http://www.ncbi.nlm.nih.gov/pubmed/23299659"")";"=HYPERLINK(""http://www.ncbi.nlm.nih.gov/pubmed/23314360"")";"=HYPERLINK(""http://www.ncbi.nlm.nih.gov/pubmed/9826344"")";tetanus toxin;172277;['Amino Acid, Peptide, or Protein', 'Hazardous or Poisonous Substance'];1076;affects, augments;"=HYPERLINK(""http://www.ncbi.nlm.nih.gov/pubmed/10768937"")";"=HYPERLINK(""http://www.ncbi.nlm.nih.gov/pubmed/10078608"")";;immune response;557453;['Organ or Tissue Function'];43,0;Euretos, Euretos, Euretos, Euretos, Euretos, SNMI, SNMI, Pubmed, Pubmed, Pubmed, Pubmed, LNC, SNMI, MEDCIN, LNC, SNMI, MSH;4, 4, 4, 4, 4, 4, 4, 4, 4, 4;Toxins, Journal of microbiology and biotechnology, Infection and immunity, The Journal of biological chemistry, umls, umls, umls, umls, umls, umls;23299659, 23314360, 9826344, 7829513, C0009064, C0009064, C0009064, C0039617, C0039617, C0039617;Euretos, Euretos;4, 4;Infection and immunity, Vaccine;10768937, 10078608
proteus mirabilis;943113;['Bacterium', 'Species'];is location of, is part of;"=HYPERLINK(""http://www.ncbi.nlm.nih.gov/pubmed/4613972"")";"=HYPERLINK(""http://www.ncbi.nlm.nih.gov/pubmed/6278022"")";;endotoxins;325567;['Carbohydrate', 'Lipid', 'Hazardous or Poisonous Substance'];6917;augments, affects, disrupts;"=HYPERLINK(""http://www.ncbi.nlm.nih.gov/pubmed/4902896"")";"=HYPERLINK(""http://www.ncbi.nlm.nih.gov/pubmed/4919425"")";"=HYPERLINK(""http://www.ncbi.nlm.nih.gov/pubmed/14233499"")";immune response;557453;['Organ or Tissue Function'];2,0;Euretos, Euretos, Pubmed, Pubmed;4, 4;Medycyna doswiadczalna i mikrobiologia, Journal of immunology (Baltimore, Md. : 1950);4613972, 6278022;Euretos, Euretos, Euretos;4, 4, 4;Journal of immunology (Baltimore, Md. : 1950), Immunology, Proceedings of the Society for Experimental Biology and Medicine. Society for Experimental Biology and Medicine (New York, N.Y.);4902896, 4919425, 14233499
proteus mirabilis;943113;['Bacterium', 'Species'];produces, is location of, is part of;"=HYPERLINK(""http://www.ncbi.nlm.nih.gov/pubmed/24771125"")";"=HYPERLINK(""http://www.ncbi.nlm.nih.gov/pubmed/17005777"")";"=HYPERLINK(""http://www.ncbi.nlm.nih.gov/pubmed/12488561"")";virulence factors;301050;['Organic Chemical', 'Biologically Active Substance', 'Hazardous or Poisonous Substance'];4101;augments, disrupts, affects, produces;"=HYPERLINK(""http://www.ncbi.nlm.nih.gov/pubmed/20865166"")";"=HYPERLINK(""http://www.ncbi.nlm.nih.gov/pubmed/22514739"")";"=HYPERLINK(""http://www.ncbi.nlm.nih.gov/pubmed/12015467"")";immune response;557453;['Organ or Tissue Function'];2,0;Euretos, Euretos, Euretos, Pubmed, Pubmed, Pubmed;4, 4, 4;Antonie van Leeuwenhoek, Journal of medical microbiology, Journal of medical microbiology;24771125, 17005777, 12488561;Euretos, Euretos, Euretos, Euretos;4, 4, 4, 4;PLoS pathogens, PloS one, Current opinion in infectious diseases, Microbiology (Reading, England);20865166, 22514739, 12015467, 11320114
proteus mirabilis;943113;['Bacterium', 'Species'];is part of;"=HYPERLINK(""http://www.ncbi.nlm.nih.gov/pubmed/12101306"")";;;toxin;2274712;['Biologically Active Substance', 'Hazardous or Poisonous Substance'];11266;disrupts, affects;"=HYPERLINK(""http://www.ncbi.nlm.nih.gov/pubmed/2904800"")";"=HYPERLINK(""http://www.ncbi.nlm.nih.gov/pubmed/3552986"")";;immune response;557453;['Organ or Tissue Function'];2,0;Euretos, Pubmed;4;Microbiology (Reading, England);12101306;Euretos, Euretos;4, 4;Antonie van Leeuwenhoek, Infection and immunity;2904800, 3552986
clostridium septicum;594669;['Bacterium', 'Species'];is part of;"=HYPERLINK(""http://www.ncbi.nlm.nih.gov/pubmed/17128973"")";;;virulence factors;301050;['Organic Chemical', 'Biologically Active Substance', 'Hazardous or Poisonous Substance'];4101;disrupts, augments, affects, produces;"=HYPERLINK(""http://www.ncbi.nlm.nih.gov/pubmed/20865166"")";"=HYPERLINK(""http://www.ncbi.nlm.nih.gov/pubmed/22514739"")";"=HYPERLINK(""http://www.ncbi.nlm.nih.gov/pubmed/12015467"")";immune response;557453;['Organ or Tissue Function'];2,0;Euretos, Pubmed;4;Biochemistry;17128973;Euretos, Euretos, Euretos, Euretos;4, 4, 4, 4;PLoS pathogens, PloS one, Current opinion in infectious diseases, Microbiology (Reading, England);20865166, 22514739, 12015467, 11320114
clostridium septicum;594669;['Bacterium', 'Species'];is part of, is location of, produces;"=HYPERLINK(""http://www.ncbi.nlm.nih.gov/pubmed/14715670"")";"=HYPERLINK(""http://www.ncbi.nlm.nih.gov/pubmed/13582143"")";"=HYPERLINK(""http://www.ncbi.nlm.nih.gov/pubmed/13598715"")";toxin;2274712;['Biologically Active Substance', 'Hazardous or Poisonous Substance'];11266;disrupts, affects;"=HYPERLINK(""http://www.ncbi.nlm.nih.gov/pubmed/2904800"")";"=HYPERLINK(""http://www.ncbi.nlm.nih.gov/pubmed/3552986"")";;immune response;557453;['Organ or Tissue Function'];2,0;Euretos, Euretos, Euretos, Pubmed, Pubmed, Pubmed;4, 4, 4;The Journal of biological chemistry, Zhurnal mikrobiologii, epidemiologii, i immunobiologii, Journal of bacteriology;14715670, 13582143, 13598715;Euretos, Euretos;4, 4;Antonie van Leeuwenhoek, Infection and immunity;2904800, 3552986
megasphaera elsdenii;4676904;['Bacterium'];is location of;"=HYPERLINK(""http://www.ncbi.nlm.nih.gov/pubmed/453682"")";;;endotoxins;325567;['Carbohydrate', 'Lipid', 'Hazardous or Poisonous Substance'];6917;augments, affects, disrupts;"=HYPERLINK(""http://www.ncbi.nlm.nih.gov/pubmed/4902896"")";"=HYPERLINK(""http://www.ncbi.nlm.nih.gov/pubmed/4919425"")";"=HYPERLINK(""http://www.ncbi.nlm.nih.gov/pubmed/14233499"")";immune response;557453;['Organ or Tissue Function'];2,0;Euretos, Pubmed;4;American journal of veterinary research;453682;Euretos, Euretos, Euretos;4, 4, 4;Journal of immunology (Baltimore, Md. : 1950), Immunology, Proceedings of the Society for Experimental Biology and Medicine. Society for Experimental Biology and Medicine (New York, N.Y.);4902896, 4919425, 14233499
clostridium tetani;330973;['Bacterium', 'Species'];is location of;"=HYPERLINK(""http://www.ncbi.nlm.nih.gov/pubmed/22977074"")";;;exotoxins;908286;['Hazardous or Poisonous Substance'];1202;disrupts, affects;"=HYPERLINK(""http://www.ncbi.nlm.nih.gov/pubmed/3007364"")";"=HYPERLINK(""http://www.ncbi.nlm.nih.gov/pubmed/3128451"")";;immune response;557453;['Organ or Tissue Function'];2,0;Euretos, Pubmed;4;Journal of medical microbiology;22977074;Euretos, Euretos;4, 4;Infection and immunity, European journal of epidemiology;3007364, 3128451
clostridium tetani;330973;['Bacterium', 'Species'];is part of;"=HYPERLINK(""http://www.ncbi.nlm.nih.gov/pubmed/15003646"")";;;tetanus toxin fragment c;864516;['Amino Acid, Peptide, or Protein', 'Hazardous or Poisonous Substance'];77;causes, affects;"=HYPERLINK(""http://www.ncbi.nlm.nih.gov/pubmed/14741167"")";"=HYPERLINK(""http://www.ncbi.nlm.nih.gov/pubmed/11159980"")";;immune response;557453;['Organ or Tissue Function'];2,0;Euretos, Pubmed;4;Vaccine;15003646;Euretos, Euretos;4, 4;Vaccine, Infection and immunity;14741167, 11159980
clostridium tetani;330973;['Bacterium', 'Species'];is location of;"=HYPERLINK(""http://www.ncbi.nlm.nih.gov/pubmed/13289310"")";;;neurotoxins;523988;['Chemical Viewed Structurally', 'Hazardous or Poisonous Substance'];2391;affects;"=HYPERLINK(""http://www.ncbi.nlm.nih.gov/pubmed/17203511"")";;;immune response;557453;['Organ or Tissue Function'];2,0;Euretos, Pubmed;4;Pharmacological reviews;13289310;Euretos;4;International journal of geriatric psychiatry;17203511
clostridium tetani;330973;['Bacterium', 'Species'];is part of;"=HYPERLINK(""http://www.ncbi.nlm.nih.gov/pubmed/12911336"")";;;virulence factors;301050;['Organic Chemical', 'Biologically Active Substance', 'Hazardous or Poisonous Substance'];4101;augments, disrupts, affects, produces;"=HYPERLINK(""http://www.ncbi.nlm.nih.gov/pubmed/20865166"")";"=HYPERLINK(""http://www.ncbi.nlm.nih.gov/pubmed/22514739"")";"=HYPERLINK(""http://www.ncbi.nlm.nih.gov/pubmed/12015467"")";immune response;557453;['Organ or Tissue Function'];2,0;Euretos, Pubmed;4;Biotechnology and applied biochemistry;12911336;Euretos, Euretos, Euretos, Euretos;4, 4, 4, 4;PLoS pathogens, PloS one, Current opinion in infectious diseases, Microbiology (Reading, England);20865166, 22514739, 12015467, 11320114
clostridium tetani;330973;['Bacterium', 'Species'];is location of, produces, is part of;"=HYPERLINK(""http://www.ncbi.nlm.nih.gov/pubmed/1874121"")";"=HYPERLINK(""http://www.ncbi.nlm.nih.gov/pubmed/14931885"")";"=HYPERLINK(""http://www.ncbi.nlm.nih.gov/pubmed/14314102"")";toxin;2274712;['Biologically Active Substance', 'Hazardous or Poisonous Substance'];11266;disrupts, affects;"=HYPERLINK(""http://www.ncbi.nlm.nih.gov/pubmed/2904800"")";"=HYPERLINK(""http://www.ncbi.nlm.nih.gov/pubmed/3552986"")";;immune response;557453;['Organ or Tissue Function'];2,0;Euretos, Euretos, Euretos, Pubmed, Pubmed, Pubmed;4, 4, 4;Disease-a-month : DM, Vojnosanitetski pregled, Surgery, gynecology & obstetrics;1874121, 14931885, 14314102;Euretos, Euretos;4, 4;Antonie van Leeuwenhoek, Infection and immunity;2904800, 3552986
proteus mirabilis;943113;['Bacterium', 'Species'];is location of, is part of;"=HYPERLINK(""http://www.ncbi.nlm.nih.gov/pubmed/4613972"")";"=HYPERLINK(""http://www.ncbi.nlm.nih.gov/pubmed/6278022"")";;endotoxins;325567;['Carbohydrate', 'Lipid', 'Hazardous or Poisonous Substance'];6917;is associated with;"=HYPERLINK(""http://www.ncbi.nlm.nih.gov/pubmed/10450775"")";;;nausea;169844;['Sign or Symptom'];2,0;Euretos, Euretos, Pubmed, Pubmed;4, 4;Medycyna doswiadczalna i mikrobiologia, Journal of immunology (Baltimore, Md. : 1950);4613972, 6278022;Euretos;4;Scandinavian journal of work, environment & health;10450775
proteus mirabilis;943113;['Bacterium', 'Species'];is part of;"=HYPERLINK(""http://www.ncbi.nlm.nih.gov/pubmed/12101306"")";;;toxin;2274712;['Biologically Active Substance', 'Hazardous or Poisonous Substance'];11266;is associated with, causes, augments;"=HYPERLINK(""http://www.ncbi.nlm.nih.gov/pubmed/21175589"")";"=HYPERLINK(""http://www.ncbi.nlm.nih.gov/pubmed/1959022"")";"=HYPERLINK(""http://www.ncbi.nlm.nih.gov/pubmed/11749934"")";nausea;169844;['Sign or Symptom'];2,0;Euretos, Pubmed;4;Microbiology (Reading, England);12101306;Euretos, Euretos, Euretos;4, 4, 4;British journal of pharmacology, Brain research bulletin, The American journal of medicine;21175589, 1959022, 11749934
clostridium septicum;594669;['Bacterium', 'Species'];is part of, is location of, produces;"=HYPERLINK(""http://www.ncbi.nlm.nih.gov/pubmed/14715670"")";"=HYPERLINK(""http://www.ncbi.nlm.nih.gov/pubmed/13582143"")";"=HYPERLINK(""http://www.ncbi.nlm.nih.gov/pubmed/13598715"")";toxin;2274712;['Biologically Active Substance', 'Hazardous or Poisonous Substance'];11266;is associated with, causes, augments;"=HYPERLINK(""http://www.ncbi.nlm.nih.gov/pubmed/21175589"")";"=HYPERLINK(""http://www.ncbi.nlm.nih.gov/pubmed/1959022"")";"=HYPERLINK(""http://www.ncbi.nlm.nih.gov/pubmed/11749934"")";nausea;169844;['Sign or Symptom'];2,0;Euretos, Euretos, Euretos, Pubmed, Pubmed, Pubmed;4, 4, 4;The Journal of biological chemistry, Zhurnal mikrobiologii, epidemiologii, i immunobiologii, Journal of bacteriology;14715670, 13582143, 13598715;Euretos, Euretos, Euretos;4, 4, 4;British journal of pharmacology, Brain research bulletin, The American journal of medicine;21175589, 1959022, 11749934
megasphaera elsdenii;4676904;['Bacterium'];is location of;"=HYPERLINK(""http://www.ncbi.nlm.nih.gov/pubmed/453682"")";;;endotoxins;325567;['Carbohydrate', 'Lipid', 'Hazardous or Poisonous Substance'];6917;is associated with;"=HYPERLINK(""http://www.ncbi.nlm.nih.gov/pubmed/10450775"")";;;nausea;169844;['Sign or Symptom'];2,0;Euretos, Pubmed;4;American journal of veterinary research;453682;Euretos;4;Scandinavian journal of work, environment & health;10450775
clostridium tetani;330973;['Bacterium', 'Species'];is location of, produces, is part of;"=HYPERLINK(""http://www.ncbi.nlm.nih.gov/pubmed/1874121"")";"=HYPERLINK(""http://www.ncbi.nlm.nih.gov/pubmed/14931885"")";"=HYPERLINK(""http://www.ncbi.nlm.nih.gov/pubmed/14314102"")";toxin;2274712;['Biologically Active Substance', 'Hazardous or Poisonous Substance'];11266;is associated with, causes, augments;"=HYPERLINK(""http://www.ncbi.nlm.nih.gov/pubmed/21175589"")";"=HYPERLINK(""http://www.ncbi.nlm.nih.gov/pubmed/1959022"")";"=HYPERLINK(""http://www.ncbi.nlm.nih.gov/pubmed/11749934"")";nausea;169844;['Sign or Symptom'];2,0;Euretos, Euretos, Euretos, Pubmed, Pubmed, Pubmed;4, 4, 4;Disease-a-month : DM, Vojnosanitetski pregled, Surgery, gynecology & obstetrics;1874121, 14931885, 14314102;Euretos, Euretos, Euretos;4, 4, 4;British journal of pharmacology, Brain research bulletin, The American journal of medicine;21175589, 1959022, 11749934
proteus mirabilis;943113;['Bacterium', 'Species'];produces, is location of, is part of;"=HYPERLINK(""http://www.ncbi.nlm.nih.gov/pubmed/24771125"")";"=HYPERLINK(""http://www.ncbi.nlm.nih.gov/pubmed/17005777"")";"=HYPERLINK(""http://www.ncbi.nlm.nih.gov/pubmed/12488561"")";virulence factors;301050;['Organic Chemical', 'Biologically Active Substance', 'Hazardous or Poisonous Substance'];4101;causes, is associated with;"=HYPERLINK(""http://www.ncbi.nlm.nih.gov/pubmed/16483819"")";"=HYPERLINK(""http://www.ncbi.nlm.nih.gov/pubmed/1854599"")";;intestinal infectious disease (disorder);3697460;['Disease or Syndrome'];2,0;Euretos, Euretos, Euretos, Pubmed, Pubmed, Pubmed;4, 4, 4;Antonie van Leeuwenhoek, Journal of medical microbiology, Journal of medical microbiology;24771125, 17005777, 12488561;Euretos, Euretos;4, 4;Microbes and infection, International journal of food microbiology;16483819, 1854599
proteus mirabilis;943113;['Bacterium', 'Species'];is part of;"=HYPERLINK(""http://www.ncbi.nlm.nih.gov/pubmed/12101306"")";;;toxin;2274712;['Biologically Active Substance', 'Hazardous or Poisonous Substance'];11266;affects, is associated with, causes;"=HYPERLINK(""http://www.ncbi.nlm.nih.gov/pubmed/25283728"")";"=HYPERLINK(""http://www.ncbi.nlm.nih.gov/pubmed/1953359"")";"=HYPERLINK(""http://www.ncbi.nlm.nih.gov/pubmed/3058560"")";intestinal infectious disease (disorder);3697460;['Disease or Syndrome'];2,0;Euretos, Pubmed;4;Microbiology (Reading, England);12101306;Euretos, Euretos, Euretos;4, 4, 4;Research in microbiology, Arkhiv patologii, Food and chemical toxicology : an international journal published for the British Industrial Biological Research Association;25283728, 1953359, 3058560
clostridium septicum;594669;['Bacterium', 'Species'];is part of;"=HYPERLINK(""http://www.ncbi.nlm.nih.gov/pubmed/17128973"")";;;virulence factors;301050;['Organic Chemical', 'Biologically Active Substance', 'Hazardous or Poisonous Substance'];4101;causes, is associated with;"=HYPERLINK(""http://www.ncbi.nlm.nih.gov/pubmed/16483819"")";"=HYPERLINK(""http://www.ncbi.nlm.nih.gov/pubmed/1854599"")";;intestinal infectious disease (disorder);3697460;['Disease or Syndrome'];2,0;Euretos, Pubmed;4;Biochemistry;17128973;Euretos, Euretos;4, 4;Microbes and infection, International journal of food microbiology;16483819, 1854599
clostridium septicum;594669;['Bacterium', 'Species'];is part of, is location of, produces;"=HYPERLINK(""http://www.ncbi.nlm.nih.gov/pubmed/14715670"")";"=HYPERLINK(""http://www.ncbi.nlm.nih.gov/pubmed/13582143"")";"=HYPERLINK(""http://www.ncbi.nlm.nih.gov/pubmed/13598715"")";toxin;2274712;['Biologically Active Substance', 'Hazardous or Poisonous Substance'];11266;affects, is associated with, causes;"=HYPERLINK(""http://www.ncbi.nlm.nih.gov/pubmed/25283728"")";"=HYPERLINK(""http://www.ncbi.nlm.nih.gov/pubmed/1953359"")";"=HYPERLINK(""http://www.ncbi.nlm.nih.gov/pubmed/3058560"")";intestinal infectious disease (disorder);3697460;['Disease or Syndrome'];2,0;Euretos, Euretos, Euretos, Pubmed, Pubmed, Pubmed;4, 4, 4;The Journal of biological chemistry, Zhurnal mikrobiologii, epidemiologii, i immunobiologii, Journal of bacteriology;14715670, 13582143, 13598715;Euretos, Euretos, Euretos;4, 4, 4;Research in microbiology, Arkhiv patologii, Food and chemical toxicology : an international journal published for the British Industrial Biological Research Association;25283728, 1953359, 3058560
clostridium tetani;330973;['Bacterium', 'Species'];is part of;"=HYPERLINK(""http://www.ncbi.nlm.nih.gov/pubmed/12911336"")";;;virulence factors;301050;['Organic Chemical', 'Biologically Active Substance', 'Hazardous or Poisonous Substance'];4101;causes, is associated with;"=HYPERLINK(""http://www.ncbi.nlm.nih.gov/pubmed/16483819"")";"=HYPERLINK(""http://www.ncbi.nlm.nih.gov/pubmed/1854599"")";;intestinal infectious disease (disorder);3697460;['Disease or Syndrome'];2,0;Euretos, Pubmed;4;Biotechnology and applied biochemistry;12911336;Euretos, Euretos;4, 4;Microbes and infection, International journal of food microbiology;16483819, 1854599
